{
  "programs": [
    {
      "id": "cached",
      "program": {
        "blocks": {
          "done": {
            "ops": [
              {
                "args": [
                  {
                    "var": "reply"
                  },
                  "value"
                ],
                "dest": "value",
                "op": "get"
              }
            ],
            "params": [
              "reply"
            ],
            "term": {
              "op": "return",
              "value": {
                "var": "value"
              }
            }
          },
          "main": {
            "ops": [],
            "params": [],
            "term": {
              "args": {
                "id": "A",
                "start_minutes": 870
              },
              "bind": "reply",
              "capture": {},
              "op": "effect",
              "resume": "done",
              "tool": "move_event"
            }
          }
        },
        "entry": "main",
        "version": 1
      },
      "inputs": {}
    },
    {
      "id": "notice",
      "program": {
        "blocks": {
          "done": {
            "ops": [
              {
                "args": [
                  {
                    "var": "reply"
                  },
                  "value"
                ],
                "dest": "value",
                "op": "get"
              }
            ],
            "params": [
              "reply"
            ],
            "term": {
              "op": "return",
              "value": {
                "var": "value"
              }
            }
          },
          "main": {
            "ops": [],
            "params": [],
            "term": {
              "args": {
                "id": "A",
                "start_minutes": 930
              },
              "bind": "reply",
              "capture": {},
              "op": "effect",
              "resume": "done",
              "tool": "move_event"
            }
          }
        },
        "entry": "main",
        "version": 1
      },
      "inputs": {}
    }
  ],
  "incumbent": "cached",
  "expected_epoch": 0,
  "expected_digest": "0000000000000000000000000000000000000000000000000000000000000000",
  "diagnostics": [
    {
      "id": "verify_time",
      "program": {
        "blocks": {
          "done": {
            "ops": [
              {
                "args": [
                  {
                    "var": "reply"
                  },
                  "value"
                ],
                "dest": "value",
                "op": "get"
              }
            ],
            "params": [
              "reply"
            ],
            "term": {
              "op": "return",
              "value": {
                "var": "value"
              }
            }
          },
          "main": {
            "ops": [],
            "params": [],
            "term": {
              "args": {
                "id": "B"
              },
              "bind": "reply",
              "capture": {},
              "op": "effect",
              "resume": "plan",
              "tool": "read_event"
            }
          },
          "plan": {
            "ops": [
              {
                "args": [
                  {
                    "var": "reply"
                  },
                  "value"
                ],
                "dest": "event",
                "op": "get"
              },
              {
                "args": [
                  {
                    "var": "event"
                  },
                  "start_minutes"
                ],
                "dest": "start",
                "op": "get"
              },
              {
                "args": [
                  {
                    "var": "start"
                  },
                  30
                ],
                "dest": "target",
                "op": "add"
              }
            ],
            "params": [
              "reply"
            ],
            "term": {
              "args": {
                "id": "A",
                "start_minutes": {
                  "var": "target"
                }
              },
              "bind": "reply",
              "capture": {},
              "op": "effect",
              "resume": "done",
              "tool": "move_event"
            }
          }
        },
        "entry": "main",
        "version": 1
      },
      "inputs": {},
      "forecasts": [
        {
          "candidate_id": "cached",
          "predicate": {
            "op": "eq",
            "path": [
              "start_minutes"
            ],
            "value": 840
          }
        },
        {
          "candidate_id": "notice",
          "predicate": {
            "op": "eq",
            "path": [
              "start_minutes"
            ],
            "value": 900
          }
        }
      ],
      "witnesses": [
        {
          "id": "B",
          "start_minutes": 840
        },
        {
          "id": "B",
          "start_minutes": 900
        }
      ]
    }
  ]
}
